{
 "schema_version": "0.1.0",
 "system": {
  "app": "BOAR harness (llama-server proxy of the app's answer step)",
  "app_version": null,
  "build": "boar-app 3bb0a3f (context builder) + eval runner feat/eval-frontier 0a024db",
  "apk_sha256": null,
  "model": {
   "name": "Maple-Preview 20B-A1B",
   "file": "maple-preview-TQ2_0-head-Q4_K.gguf",
   "sha256": "221f792cc9760d27a34f449b4229e258fa968a63bd4213993e45d9c0bb477a9e",
   "quant": "TQ2_0-head-Q4_K",
   "params_total_b": 20.0,
   "params_active_b": 1.0,
   "file_bytes": 5901782560
  },
  "runtime": {
   "engine": "llama-server, llama.cpp b11010 4bc272f (2026-09-16, CPU build, GGML_METAL=OFF)",
   "backend": "cpu",
   "threads": 4,
   "n_ctx": 4096,
   "weight_repack": true,
   "thinking": "always",
   "sampling": {
    "temperature": 0.7,
    "top_k": 40,
    "top_p": 0.95,
    "min_p": 0.05,
    "seed": 42
   }
  }
 },
 "measurement": {
  "kind": "proxy",
  "method": "harness-llama-server",
  "date": "2026-09-30T15:49:29-03:00",
  "operator": "Kiln (R&D)",
  "conditions": "Shared Mac mini, heavy queue, one job at a time",
  "notes": [
   "PROXY: Mac mini M4 CPU with -t 4 stands in for a phone. Speeds are upper bounds, never ranked against device rows.",
   "cache_prompt=false: every answer pays the full prefill (the app reuses the fixed persona prefix on dense models).",
   "Host 1-min load at request start: 6.46-7.98 (gate < 8, re-measure > 12; reruns: 0)."
  ]
 },
 "device": {
  "class": "desktop",
  "model": "Mac mini (M4)",
  "soc": "Apple M4",
  "cpu": "4P+6E, CPU only, 4 threads",
  "ram_bytes": 17179869184,
  "os": "macOS 26.6.2",
  "build_fingerprint": null
 },
 "workload": {
  "question_set": "kiln-exp01: v2-hard12 + lantern52 (64 items)",
  "question_set_sha256": null,
  "n_questions": 64,
  "n_llm_answers": 56,
  "context_tokens": {
   "n": 56,
   "p50": 614.0,
   "p95": 941.5,
   "mean": 594.429,
   "min": 270,
   "max": 1053
  },
  "corpus": "--corpus essential + boar-crypto + boar-wikivoyage-en (app retrieval at 3bb0a3f)"
 },
 "latency": {
  "ttft_model_ms": {
   "n": 56,
   "p50": 2655.55,
   "p95": 5534.0,
   "mean": 3102.418,
   "min": 1101.7,
   "max": 15440.9
  },
  "ttft_answer_ms": {
   "n": 56,
   "p50": 4744.5,
   "p95": 9459.275,
   "mean": 5092.234,
   "min": 1835.8,
   "max": 17248.8
  },
  "ttft_e2e_ms": {
   "n": 0,
   "p50": null,
   "p95": null,
   "mean": null,
   "min": null,
   "max": null
  },
  "includes_model_load": false,
  "tps": {
   "n": 56,
   "p50": 78.976,
   "p95": 88.021,
   "mean": 76.496,
   "min": 49.137,
   "max": 93.852
  },
  "tps_engine_reported": {
   "n": 56,
   "p50": 78.986,
   "p95": 88.014,
   "mean": 76.494,
   "min": 49.141,
   "max": 93.849
  },
  "prefill_tps": {
   "n": 56,
   "p50": 232.017,
   "p95": 251.104,
   "mean": 213.95,
   "min": 68.288,
   "max": 252.982
  },
  "reasoning_ms": {
   "n": 56,
   "p50": 1683.9,
   "p95": 4393.725,
   "mean": 1989.816,
   "min": 423.3,
   "max": 6604.9
  },
  "total_ms": {
   "n": 56,
   "p50": 5496.65,
   "p95": 9935.625,
   "mean": 5807.311,
   "min": 2244.3,
   "max": 18203.5
  },
  "total_scope": "model",
  "retrieval_ms": {
   "n": 0,
   "p50": null,
   "p95": null,
   "mean": null,
   "min": null,
   "max": null
  },
  "model_load_ms": 5100.0,
  "empty_answers": 2
 },
 "memory": {
  "peak_rss_bytes": 5447548928,
  "peak_anon_bytes": 541184920,
  "peak_pss_bytes": null,
  "method": "ps rss sampled every 0.25 s + /usr/bin/time -l 'peak memory footprint'; main run",
  "valid": true,
  "low_memory_kills": 0
 },
 "sustained": {
  "n_queries_in_session": 56,
  "session_minutes": null,
  "tps_first5": 60.525,
  "tps_last5": 84.367,
  "tps_ratio_last_first": 1.394,
  "ttft_ratio_last_first": 0.417,
  "thermal_status_start": null,
  "thermal_status_end": null,
  "battery_temp_c_start": null,
  "battery_temp_c_end": null,
  "battery_pct_drop": null
 },
 "offline_proof": {
  "status": "not-applicable",
  "tool": null,
  "report_sha256": null,
  "runtime_traffic": null
 },
 "per_query": [
  {
   "query_id": "cry-001",
   "route": "llm",
   "context_tokens": 940,
   "ttft_model_ms": 3896.9,
   "ttft_answer_ms": 7965.2,
   "ttft_e2e_ms": null,
   "tps": 70.714,
   "prefill_tps": 241.587,
   "total_ms": 8804.0,
   "generated_tokens": 348,
   "flagged": false
  },
  {
   "query_id": "cry-005",
   "route": "llm",
   "context_tokens": 754,
   "ttft_model_ms": 3542.4,
   "ttft_answer_ms": 5630.4,
   "ttft_e2e_ms": null,
   "tps": 60.525,
   "prefill_tps": 213.155,
   "total_ms": 6516.4,
   "generated_tokens": 181,
   "flagged": false
  },
  {
   "query_id": "cry-009",
   "route": "llm",
   "context_tokens": 1053,
   "ttft_model_ms": 15440.9,
   "ttft_answer_ms": 17248.8,
   "ttft_e2e_ms": null,
   "tps": 56.107,
   "prefill_tps": 68.288,
   "total_ms": 18203.5,
   "generated_tokens": 156,
   "flagged": false
  },
  {
   "query_id": "cry-012",
   "route": "llm",
   "context_tokens": 606,
   "ttft_model_ms": 4273.2,
   "ttft_answer_ms": 6835.6,
   "ttft_e2e_ms": null,
   "tps": 64.328,
   "prefill_tps": 142.187,
   "total_ms": 7662.1,
   "generated_tokens": 219,
   "flagged": false
  },
  {
   "query_id": "cry-016",
   "route": "llm",
   "context_tokens": 779,
   "ttft_model_ms": 8750.1,
   "ttft_answer_ms": 10668.5,
   "ttft_e2e_ms": null,
   "tps": 49.137,
   "prefill_tps": 89.188,
   "total_ms": 11599.3,
   "generated_tokens": 141,
   "flagged": false
  },
  {
   "query_id": "cry-020",
   "route": "llm",
   "context_tokens": 869,
   "ttft_model_ms": 6393.5,
   "ttft_answer_ms": 10060.4,
   "ttft_e2e_ms": null,
   "tps": 52.146,
   "prefill_tps": 136.083,
   "total_ms": 11283.6,
   "generated_tokens": 256,
   "flagged": false
  },
  {
   "query_id": "trv-010",
   "route": "llm",
   "context_tokens": 567,
   "ttft_model_ms": 5247.5,
   "ttft_answer_ms": 8163.8,
   "ttft_e2e_ms": null,
   "tps": 55.44,
   "prefill_tps": 108.354,
   "total_ms": 9486.3,
   "generated_tokens": 236,
   "flagged": false
  },
  {
   "query_id": "vit-hum-001",
   "route": "llm",
   "context_tokens": 273,
   "ttft_model_ms": 2273.0,
   "ttft_answer_ms": 4273.1,
   "ttft_e2e_ms": null,
   "tps": 70.79,
   "prefill_tps": 120.599,
   "total_ms": 5183.0,
   "generated_tokens": 207,
   "flagged": false
  },
  {
   "query_id": "vit-hum-002",
   "route": "llm",
   "context_tokens": 289,
   "ttft_model_ms": 1391.8,
   "ttft_answer_ms": 5967.4,
   "ttft_e2e_ms": null,
   "tps": 75.558,
   "prefill_tps": 208.926,
   "total_ms": 6884.3,
   "generated_tokens": 416,
   "flagged": false
  },
  {
   "query_id": "vit-hum-003",
   "route": "llm",
   "context_tokens": 296,
   "ttft_model_ms": 4007.5,
   "ttft_answer_ms": 6796.3,
   "ttft_e2e_ms": null,
   "tps": 64.807,
   "prefill_tps": 74.186,
   "total_ms": 7463.9,
   "generated_tokens": 225,
   "flagged": false
  },
  {
   "query_id": "vit-hum-004",
   "route": "llm",
   "context_tokens": 676,
   "ttft_model_ms": 3955.8,
   "ttft_answer_ms": 5466.2,
   "ttft_e2e_ms": null,
   "tps": 68.078,
   "prefill_tps": 171.127,
   "total_ms": 6232.6,
   "generated_tokens": 156,
   "flagged": false
  },
  {
   "query_id": "vit-hum-005",
   "route": "llm",
   "context_tokens": 454,
   "ttft_model_ms": 2083.3,
   "ttft_answer_ms": 3774.2,
   "ttft_e2e_ms": null,
   "tps": 82.959,
   "prefill_tps": 218.495,
   "total_ms": 4397.7,
   "generated_tokens": 193,
   "flagged": false
  },
  {
   "query_id": "vit-hum-006",
   "route": "llm",
   "context_tokens": 358,
   "ttft_model_ms": 1535.2,
   "ttft_answer_ms": 1958.5,
   "ttft_e2e_ms": null,
   "tps": 81.596,
   "prefill_tps": 236.119,
   "total_ms": 2748.5,
   "generated_tokens": 100,
   "flagged": false
  },
  {
   "query_id": "vit-fa-001",
   "route": "llm",
   "context_tokens": 741,
   "ttft_model_ms": 3053.1,
   "ttft_answer_ms": 5861.1,
   "ttft_e2e_ms": null,
   "tps": 81.151,
   "prefill_tps": 243.069,
   "total_ms": 6577.4,
   "generated_tokens": 287,
   "flagged": false
  },
  {
   "query_id": "vit-fa-002",
   "route": "llm",
   "context_tokens": 749,
   "ttft_model_ms": 3452.0,
   "ttft_answer_ms": 4771.8,
   "ttft_e2e_ms": null,
   "tps": 73.007,
   "prefill_tps": 218.378,
   "total_ms": 5438.1,
   "generated_tokens": 146,
   "flagged": false
  },
  {
   "query_id": "vit-fa-003",
   "route": "llm",
   "context_tokens": 500,
   "ttft_model_ms": 2075.1,
   "ttft_answer_ms": 3140.0,
   "ttft_e2e_ms": null,
   "tps": 72.51,
   "prefill_tps": 241.582,
   "total_ms": 3964.5,
   "generated_tokens": 138,
   "flagged": false
  },
  {
   "query_id": "vit-fa-004",
   "route": "llm",
   "context_tokens": 456,
   "ttft_model_ms": 1821.4,
   "ttft_answer_ms": 2727.5,
   "ttft_e2e_ms": null,
   "tps": 73.862,
   "prefill_tps": 251.043,
   "total_ms": 3256.5,
   "generated_tokens": 107,
   "flagged": false
  },
  {
   "query_id": "vit-fa-005",
   "route": "llm",
   "context_tokens": 270,
   "ttft_model_ms": 1211.3,
   "ttft_answer_ms": 3140.6,
   "ttft_e2e_ms": null,
   "tps": 82.875,
   "prefill_tps": 226.523,
   "total_ms": 4046.9,
   "generated_tokens": 236,
   "flagged": false
  },
  {
   "query_id": "vit-fa-007",
   "route": "llm",
   "context_tokens": 516,
   "ttft_model_ms": 2101.5,
   "ttft_answer_ms": 5889.9,
   "ttft_e2e_ms": null,
   "tps": 81.753,
   "prefill_tps": 246.056,
   "total_ms": 6187.0,
   "generated_tokens": 335,
   "flagged": false
  },
  {
   "query_id": "vit-fa-008",
   "route": "llm",
   "context_tokens": 897,
   "ttft_model_ms": 3660.8,
   "ttft_answer_ms": 5134.7,
   "ttft_e2e_ms": null,
   "tps": 81.925,
   "prefill_tps": 245.391,
   "total_ms": 5772.5,
   "generated_tokens": 174,
   "flagged": false
  },
  {
   "query_id": "vit-fa-009",
   "route": "llm",
   "context_tokens": 408,
   "ttft_model_ms": 1667.8,
   "ttft_answer_ms": 3367.0,
   "ttft_e2e_ms": null,
   "tps": 84.753,
   "prefill_tps": 245.192,
   "total_ms": 4133.8,
   "generated_tokens": 210,
   "flagged": false
  },
  {
   "query_id": "vit-fa-010",
   "route": "llm",
   "context_tokens": 271,
   "ttft_model_ms": 1286.7,